Administrative,Business Strategy,Data Center & Network,Developer Relations,Finance,Hardware Engineering,IT & Data Management,Legal & Government Relations,Manufacturing & Supply Chain,Marketing & Communications,Network Engineering,Partnerships,People Operations,Product & Customer Support,Program Management,Real Estate & Workplace Services,Sales & Account Management,Sales Operations,Software Engineering,Technical Infrastructure,Technical Solutions,Technical Writing,User Experience & Design
MBA Intern 2018,"Chief of Staff, Google Hardware","Program Manager, Supply Chain Data Management","Developer Advocate, Partner Engineering","Google Cloud Customer Engineer Manager, Financial Services","Supplier Development Engineer, Camera, Consumer Hardware","Linguist, Natural Language Understanding, Machine Intelligence","Head of Government Channels, Google Cloud","Supplier Development Engineer (SDE), Cable/Connector","Communications and Programs Manager, Google Technical Services","Network Implementation Engineer, Corporate Network","Strategic Technology Partner Manager, Healthcare and Life Sciences",Recruiter,"Data Analyst, Consumer Hardware",Google Cloud Program Manager,"Cluster Manager, Security (English, Chinese)","Strategic Cloud DevOps and Infrastructure Engineer, Google Cloud Professional Services","Solutions Engineer, Google Cloud","Software Engineering Manager, Cloud Storage, Site Reliability Engineering","Technical Program Manager, Cloud Infrastructure Planning and Resource Management","Data Analyst, Product and Tools Operations, Google Technical Services","Technical Writer, University Graduate","Design Producer, Hardware"
"Research Programs Specialist, Tech Programs and Events","Product Strategist, Growth, YouTube","Technical Program Manager, Data Center Design","Developer Advocate, Cloud Platform","BOLD Intern, Summer 2018",Manufacturing Test Engineer,"Corporate Operations Engineer, IT Support, EPM",Privacy Counsel,"Manufacturing Business Manager, Google Hardware","Program Manager/Producer, Global Hardware Marketing","Network Engineer, Corporate Network",Partner Onboarding Manager (Americas),Staffing Manager,"Survey Lead, Google Cloud Support","Program Manager, Audio Visual (AV) Deployments",Campus Manager (English and Mandarin),"Enablement Lead, Global Consulting Partnerships, Google Cloud","Product Specialist, Google Cloud (English)","Software Engineer Manager, Tools and Infrastructure","Systems Administrator, Windows","Associate Account Strategist (Czech/Slovak), Global Customer Experience",,"User Experience Design Intern, Summer 2018"
"Administrative Business Partner, Cloud",MBA Intern (Korean-English Bilingual) 2018,,"Developer Advocate, Web","Business Intern 2018, Mexico","Global Supply Chain Manager, Display/Touch, Consumer Hardware","Corporate Operations Engineer, Finance IT Support",Public Policy and Government Relations Manager,"Global Supply Chain Manager, Cable and Connector, Consumer Hardware",Executive Briefing Manager,"Network Operations Engineer, Corporate","Partner Strategy Planning Lead, Google Cloud","Project Manager, Staffing Services Operations","Quantitative Analyst, Ads Quality","Technical Program Manager, ASIC Development",Real Estate Portfolio Administrator,"Mobile UX Lead, Large Customer Sales (English, Mandarin)",Brand Solution Strategist,Software Engineer,"Software Engineer, Site Reliability Engineering","Solutions Architect, Healthcare and Life Sciences, Google Cloud",,Interaction Designer
"MBA Intern, Summer 2018","MBA Intern, Summer 2018",,,"Business Intern 2018, Colombia","Engineering Manager, Consumer Hardware",,Trademark Counsel,"Product Operations Program Manager, Consumer Hardware","Technical Analytics Architect, Google Cloud Online Experience",Network Operations Engineer,"Partner Operations Manager, Commerce, Google Technical Services",Google Childrens Center Teacher,"Solutions Consultant, Ads, Google Professional Services",Head of Professional Services,Real Estate and Workplace Services (REWS) Business Partner,"Manager, Large Customer Sales (Spanish)","Analytical Lead, Pharmaceutical Vertical","Graphics Software Engineer, Robotics Simulation, Google Cloud Platform",Software Asset Management Vendor Manager,"Associate Account Strategist (Ukrainian), GMS Sales",,User Experience Researcher
"Technical Solutions Engineer, Google Cloud Platform","Global Head of Strategy and Operations, Brand Studio",,,"Business Intern 2018, Brazil",Analog & CAD Automation Engineer,,"Associate Legal Counsel, Commercial","Global Supply Chain and Sourcing Manager, CPUs, Consumer Hardware","Product Marketing Manager, YouTube","Technical Solutions Consultant, Android Automotive, Android Partner Engineering","Global Technical Alliance Manager, Strategic Consultative Partnerships","Recruiter, Google Cloud (Japanese or Korean)","Partner Sales Engineer Manager, Google Cloud","Technical Trainer Manager, Google Cloud",Global REWS Marketing and Communications Manager,"Performance Video Agency Specialist, YouTube","Analyst, Partnerships and Trading, Large Customer Sales","Software Engineer, Performance Modeling","Strategic Negotiator, Data Center","Solution Architect, Google Cloud Platform (Apigee)",,"UX Researcher (English, Mandarin)"
"Protective Services Specialist, Event Security","Operations Manager, Global Partnerships",,,"Business Intern 2018, Argentina",FPGA Design/Prototyping Engineer,,"Counsel, Regulatory Investigations","Global Supply Chain Manager, Audio, Consumer Hardware","Program Manager, Web Producer, Google Cloud",,"Android Platform Partnerships Lead, Android and Play Business",Global Head of Technical Staffing Operations,"Quantitative Analyst Lead, Trust and Safety","Presales Manager, New Business Development","Technical Program Manager, Executive and Event Production","Platform Sales Manager, Media Platforms Account Lead","Research Analyst, Market Insights","Software Engineer, Android Applications, Verily Life Sciences - Cambridge","Technical Program Manager, Site Reliability Engineering","Machine Learning Product Specialist, Google Cloud (EMEA)",,"Android UX Engineer, Design"
"Technical Account Manager, Search Distribution, Google Technical Services Velocity","Curriculum Architect Manager, Scaled Engagement and Learning, Google Technical Services",,,Accountant,"Analog / Mixed Signal IC Design Engineer, Verily Life Sciences - South San Francisco",,Associate Legal Counsel (English and Russian),"Global Supply Chain Manager, Keyboard and Trackpad, Consumer Hardware","Social Marketing Manager, Google Social Lab",,"Strategic Partner Development Manager, Retail (English, German)","Operations Specialist, Google People Services","Product Specialist, Google Cloud","High Performance Computing (HPC) Specialist, Google Cloud","Project Manager, Security Systems","Sales Development Manager, Cross-Vertical Team",Performance Specialist (Korean),Front End Software Engineer,Cloud DevOps and Infrastructure Engineer for Silicon Design,"Partner Sales Engineer, Google Cloud",,Quantitative User Experience Researcher
"Executive/Administrative Business Partner, YouTube","Strategy and Business Analyst, Go-to-Market, Google Marketing Solutions",,,"Internal Audit, Technology Auditor",ASIC Physical Design Engineering Tech Lead & Manager,,Associate Legal Counsel (Commercial) Google Cloud,"Global Supply Chain Manager, Power, Consumer Hardware","Product Specialist, New Hardware Devices and Platforms, Google Play",,"Partner Development Manager, Google Cloud","Program Manager (Risk Management), Extended Workforce Solutions","Process Specialist, Curated Formats, Google Technical Services","Technical Program Manager, Google Cloud Functions",Global Investigator,Online Sales Account Manager (Turkish),"Manager of Store Operations, Hardware Partnerships (English and German)","Software Engineer, Image Processing, Consumer Hardware","Systems Engineer, Site Reliability Engineering","Technical Solutions Engineer, Chrome and Android, Google Cloud",,"Industrial Designer, Hardware"
,Lead Data Scientist,,,"Senior Technology Auditor, Internal Audit",Cell Design and Process Engineer,,"AdSpam Analyst, Trust and Safety","Global Sourcing and Supply Manager, Camera, Consumer Hardware","Partner Marketing Manager, Google Cloud",,"Chrome OEM Channel Sales Manager, Chrome Enterprise and Education","HR Business Partner, Employee Relations","Quantitative Analyst, Trust and Safety","Program Manager, Operations, Google Cloud Web",Real Estate District Development Executive,"Field Sales Representative, Google Cloud (DACH)","Analytical Lead, Pure Play Retail","Cloud Integration Software Engineer, Robotics Simulation, Google Cloud Platform","Mechanical Engineer, Data Center","Head of Partner Engineering, Google Cloud",,"UX Engineer, Front End"
,"Product Analyst, Data Science",,,Brand and Reputation Strategy Lead,"Hardware System Engineer, System on a Chip",,"Associate Legal Counsel, Commercial, Google Cloud","Global Supply Chain Manager, Packaging","Operations Manager, International and COO Communications, Google Cloud",,"Strategic Partner Manager, Product Partnerships (Geo)","Manager, Online Hiring Strategy & Inbound Marketing","Program Manager, Cloud Platform Sales Development, Google Cloud",Global Partner Business Development Manager,Physical Security Manager,Programmatic Account Manager,"Measurement and Attribution Specialist (English, German)","Software Engineer, Android Applications, Verily Life Sciences - South San Francisco",Operations Engineer,"Technical Solutions Consultant, Google Technical Services (English, German)",,Visual Designer
,"Business Operations Lead, Google Play",,,"Payroll Operations Controller, Financial Operations (English, Portuguese)","Supplier Development Engineer, Sensor Module",,"Operations Support Associate (French), Legal Online Support","Global Supply Chain Manager, FPCB and PCB, Consumer Hardware",Business Intern 2018,,"Partner Business Manager, Google Cloud (Spanish)",People Consultant,"Delivery Manager, Optimization Support, EMEA","Technical Program Manager, Corporate Engineering","Food Service Manager, Americas","Field Sales Representative, Google Cloud","Data Analyst, SMB Sales Growth Programs, Google Cloud","Software Engineer, Virtual Prototyping","Application Engineer, SAP","Measurement Solutions Consultant, Google Technical Services",,User Experience Research Lead
,"Consumer Operations Product Support Manager, (Multiple Products)",,,"Risk Advisor, YouTube","Manufacturing Engineer, Verily Life Sciences - South San Francisco",,Legal Operations Analyst,"Global Supply Chain and Sourcing Manager, Sensors, Consumer Hardware","Live Show Producer, Events and Experiences",,"Partner Business Manager, System Integrator Partnerships","Operations Specialist, Google People Services (Traditional Mandarin)","Associate Account Strategist, Sales, Google Marketing Solutions (Portuguese)","Community Enablement Manager, Global Partner, Google Cloud",Real Estate Portfolio Management Lead,Online Sales Account Manager (Italian),"Field Sales Representative, Google Cloud (English, Dutch, French)","Application Engineer, Legal",,"Big Data Product Specialist, Google Cloud (English)",,"Android UX Engineer, Front End, Waze"
,"Business Intern, Veteran",,,"Inventory Accounting Manager, Consumer Hardware",,,"Regional Legal Counsel, Japan","Supply Planning Program Manager, Consumer Hardware","Head of Field Marketing (North Asia), Google Cloud",,"Partner Specialist, SMB, Google Cloud",Sourcing Team Manager,"Quality Program Manager, Global Vendor Operations, YouTube","Cloud Consultant, Professional Services, Google Cloud",Real Estate Development Executive,"Enterprise Customer Development Representative, Google Cloud","Inside Sales Representative, Google Cloud",Software Engineering Manager,,Technical Contracts Manager,,"User Experience Design Intern, Mid-Year 2018"
,"Product Analytics Lead, Data Science",,,"APAC Accounting Lead, Non-Ads Products",,,"Legal Specialist, Litigation Paralegal",Sustaining Manufacturing Process Engineer,"Communications Manager, Ads and Commerce",,"Retail Partnerships Manager, Gift Cards, Google Play",Staffing Programs Specialist,"Data Analyst, Product Trust and Safety","Technical Enablement Manager, Global Partner, Google Cloud","Protective Services Specialist, Executive Protection","Strategic Agency Consultant, Google Marketing Solutions (Dutch)","Data Science Analyst, Revenue Strategy and Operations, Google Marketing Solutions","Software Engineer, Verily Life Sciences - South San Francisco",,"Vendor Operations Specialist (EMEA), Google Technical Services Consumers",,"Industrial Design Intern, Summer 2018"
,"Business Strategy Lead, Phones Business",,,Strategic Vendor Manager,,,"Associate Contracts Manager, Ads",,"Product Marketing Manager, IoT, Google Cloud Platform",,"Strategic Partner Development Manager, Google Marketing Solutions, Channel Sales",People Partner,"Associate Account Strategist, Sales, Google Marketing Solutions (French)","Program Manager, Mergers and Acquisitions, Corporate Engineering",Campus Security Manager,"Key Account Manager, Large Customer Sales",,Software Engineer (English),,Measurement and Attribution Specialist (Northern Europe),,UX Content Strategist Lead
,"Head of Business Development, Strategic Partnerships, Google Cloud",,,"Business Intelligence and Analytics Manager, Finance",,,"Associate Legal Counsel, Development, Production and Licensing, YouTube Originals",,"Merchandising Manager, Games, Google Play (English, Russian)",,"Business Development Manager, Next Billion Users",Recruiter (GBOP),"Business Trainer, Google Cloud","Business Lead for Partner Relationship Management (PRM) Solution, Google Cloud",Facilities Manager,"SMB Sales Executive, Google Cloud",,"Software Engineer, Tools and Infrastructure",,"Solutions Engineer, Google Cloud Healthcare and Life Sciences",,"UX Engineer, Front End, Waze"
,"Strategy and Operations Manager, Consumer Hardware Products",,,Supply Chain Procurement Operations Manager,,,"Ethics and Compliance Associate Counsel, US Political Law",,"Product Marketing Manager, Google Play, Japan (English, Japanese)",,"Partner Sales Manager, Go-to-Market Partnerships, Google Cloud","Specialist, Tech Programs and Events, Google Cloud","Enterprise Customer Development Representative, Google Cloud (Southeast Asian Language)","Training Partners Business Manager, Americas, Google Cloud",,"Product Analyst, Product and Sales Activation, Google Marketing Solutions",,"Firmware Engineer, Verily Life Sciences - South San Francisco",,"Technical Specialist, Google Technical Services, Ads",,Voice User Interface Designer
,"SMB Sales Manager, International, Google Cloud",,,"Senior Tax Manager, Treasury",,,"Associate Legal Counsel, Commercial (Google Cloud Platform)",,"Industry Public Relations Manager, Google Cloud",,"Strategic Partner Development Manager, Carriers (English, German)",Leadership Staffing Recruiter,"Data Analyst, Trust and Safety","Technical Program Manager, Enterprise Communications",,"AdMob Technical Sales Lead, Online Partnerships Group",,"Software Test Engineer, Mobile and Web Applications, Verily Life Sciences - Mountain View",,"Strategic Cloud Engineer, Google Cloud Professional Services",,"Interaction Designer, Google Photos"
,Global Business Strategy Manager,,,"Finance Manager, Pixel",,,"Team Lead, Online Support",,"Partner Public Relations Manager, Google Cloud",,"Partner Support Manager, Android Partner Engineering","Project Lead, Staffing Services Operations Team","Enterprise Customer Development Representative, Google Cloud (Japanese)","Program Manager, Behavioral Health, Verily Life Sciences - South San Francisco",,"Account Manager, Google Cloud Platform",,"iOS Application Developer, Project Baseline, Verily Life Sciences - Mountain View",,"Security Product Specialist, Google Cloud Platform",,UX Design Manager
,"Project Manager (EMEA), Customer Experience, Go-to-Market",,,Treasury Accounting Manager,,,"Associate Commercial Counsel, Google Cloud",,"Communications Manager, Developer and Emerging Ads",,"Partner Training Manager, Android","Recruiter, Google Cloud","Sales Engineering Manager, Shared Services, Google Cloud","Onsite Training Programs Lead, Google Cloud",,"Account Executive, Democratic Elections",,"Web Solutions Engineer, Product and Tools Operations",,"Media and Entertainment Specialist, Google Cloud",,UX Writer
,"Global Business Strategy Manager, Sales Productivity, Central Strategy and Operations",,,"Senior Manager, Alphabet IT Internal Controls, SOX and Compliance",,,"Operations Specialist (Polish), Online Legal Support",,"Product Manager, Growth, Waze",,"Strategic Partner Manager, Global Partnerships (Hebrew, Russian)",Process Design and Technology Project Manager,"Associate Account Strategist, Sales, Google Marketing Solutions (Spanish)",Customer Success Manager,,"Sales Lead, SMB, Google Cloud Platform",,"Software Engineering Manager, G Suite",,"Strategic Cloud Engineer, Google Professional Services",,"User Experience Researcher, Google Cloud Support"
,"Scaled Abuse Analyst, YouTube",,,SOX Ads Revenue Analyst,,,US GAAP Accountant,,"Associate Product Marketing Manager Program (APMM), Japan Hardware Marketing",,"Online Partner Manager (MENA), YouTube","Global Solutions Advisor, Extended Workforce Solutions","Enterprise Customer Development Representative, Google Cloud (English, Mandarin, Cantonese)","Program Manager, Geo Data Operations",,"Account Manager, Display, Media Buying Solutions (Spanish)",,Video Algorithm Engineer,,"Associate Account Strategist (Hungarian), Global Customer Experience",,"Regional Lead (APAC), Google Assistant Personality, Doodle Team"
,"Business Systems Analyst, PLM and CAD",,,"Revenue Accountant, Cloud Business Finance",,,Associate Product Counsel,,"Internal Communications Manager, Ads and Commerce",,"Account Manager, Online Partnerships Group (Thai)","People Analyst, Reporting and Insights","Associate Account Strategist, Global Customer Experience (Spanish)","Product Strategy and Operations Lead, Consumer Payments (English, Russian)",,"Account Executive, Mid Market Sales, Google Marketing Solutions",,"High-level Synthesis Design Engineer, Consumer Hardware",,"Technical Specialist, Google Technical Services (English and Italian)",,UX Content Strategist
,"Lead Product Analyst, Data Science",,,"Tax Analyst, Employment Tax",,,"Legal and Policy Operations Specialist (English and Korean), YouTube",,"Global Campaigns Manager, Google Cloud (Apigee)",,"Channel Manager, Hardware Partnerships","Policy Specialist, Extended Workforce Solutions","Enforcement Analyst, Trust and Safety, YouTube",Vendor Operations Program Manager,,DoubleClick Search Lead (Full-time/Part-time),,"Software Engineer, Accessibility",,"Technical Account Manager, Google Technical Services (Mandarin or Cantonese)",,Hardware Interaction Designer
,Network Business Analyst,,,"Revenue Senior Accountant, Business Controllership, Consumer Hardware",,,"Legal Specialist Team Lead, Online Operations",,"Content Strategist, Consumers, Google Technical Services",,"Global Partnerships Solutions Manager, Telecom",Tech Recruiter,"Partner Support Manager, Chromebook, Platforms and Ecosystems","Manager, Performance Specialists",,"Platform Sales Manager, DoubleClick, Media Buying Solutions",,"Video Codec Design Engineer, Consumer Hardware",,"Manager, Measurement & Attribution Specialists, Google Technical Professional Services",,Quantitative User Experience Research Lead
,"Strategy and Operations Manager, Go-To-Market, Partnerships",,,"Anti-Money Laundering (AML) Operations Manager, Payments Compliance",,,"Associate Contracts Manager, Cloud",,"Customer Growth Marketing Manager, Google Cloud",,"Business Development Manager, OEM Partnerships, Google Cloud",Associate Lead Recruiter (Hardware),"Community Manager, Social/Communications, Hardware","Operations Lead, Google Play",,Online Sales Account Manager (Dutch),,"Software Test Engineer, Devices, Verily Life Sciences - South San Francisco",,"Technical Solutions Consultant, Google Technical Services",,UX Design Lead
,"Business Analyst, Google Play Partner Promotions Strategy",,,Investment Grade Trader,,,Legal Intern,,"Product Marketing Manager, Databases, Google Cloud",,"Publisher Intelligence Analyst, Online Partnerships Group",Staffing Services Associate,"Associate Account Strategist, GMS Sales and Services, University Graduate","Technical Program Manager, Fiber Network Data",,"Account Executive, Mid-Market, Google Marketing Solutions (English and German)",,,,"G Suite Strategic Cloud Engineer, Google Professional Services",,"UX Engineer, Design (Android or iOS)"
,"Head of Go-To-Market, Brazil",,,Financial Accountant/Controller,,,"Associate Commercial Counsel, Research (Health)",,Communications Manager (Full-time/Part-time),,"Strategic Partner Development Manager, New Ads Business Development",Talent Acquisition Specialist,"Associate Account Strategist (Romanian), Google Marketing Solutions Sales","Technical Program Manager, Network Business Operations",,"Deal Manager, Google Cloud",,,,"Technical Solutions Consultant, Android",,"Interaction Designer, YouTube"
,"Data Scientist / Quantitative Analyst Technical Lead, Engineering",,,Alphabet Corporate Accounting Manager,,,Regional Counsel (Southeast Asia),,"Central Strategy and Operations Lead, Cloud Marketing",,"Global Partnerships Solutions Lead, News and Publishing",Staffing Channels Specialist,"Vendor Strategy Manager, Google Technical Services","Program Manager, Maps Support, Google Cloud",,"Partner Business Manager (DACH), System Integrator Partnerships (German)",,,,"Technical Solutions Engineer, G Suite, Google Cloud",,UX Program Manager
,"Head of Platforms and Display, Go-to-Market Strategy and Operations",,,"Head of Ads Finance, Acquisitions, Google Marketing Solutions",,,Legal Assistant,,Media Research Manager (English and Turkish speaker),,"Strategic Partner Manager (Technical), Channel Sales",Staffing Services Lead,"Enterprise Customer Development Representative, Google Cloud (English, Korean)","Program Manager, Geo Merchant",,"Account Manager, Media Buying Solutions",,,,"Partner Technology Manager, Product and Tool Operations, Google Technical Services",,"Interaction Designer, Publisher UX"
,"Business Strategy Lead, Phone Accessories (Google Hardware)",,,"Finance Auditor, Internal Audit",,,"Associate Legal Counsel, Commercial, Ads",,"SEO Strategist, Online Experience, Google Cloud",,"Partner Development Manager, Online Partnerships Group (English, Mandarin)","Leadership Researcher, APAC","Associate Account Strategist, Global Customer Experience (Italian)","Product Operations and Strategy Lead, Engineering",,"Account Strategist, Global Partnerships Sales Engine",,,,Programmatic Account Strategist (English),,"Interaction Designer, Site Reliability - London"
,"Strategy Associate, Search and Assistant Distribution, Global Partnerships",,,"Financial Analyst, Central Finance Planning and Analysis",,,Associate Commercial Counsel,,"Americas Books Merchandising Manager, Google Play",,"Associate Partnership Manager, Hardware Partnerships (Part-time/Full-time)",Disability Accommodation Specialist,,"Product Specialist, Hardware",,"Mobile Web Specialist, LCS Central Europe (German)",,,,Advertising Operations Associate (Korean),,"User Experience Researcher, Play"
,"Agency Go-to-Market and Business Analytics Manager, Spanish Speaking LatAm",,,"Principal, Financial Technology and Strategy, Alphabet",,,"Associate Legal Counsel (Commercial), Mobile",,Internal Executive Communications and Event Producer,,"Business Development Manager, Google Cloud Partnerships","Operations Specialist, Google People Services (Japanese)",,"Program Manager, Product Data Management",,GMS Sales Agency Lead,,,,"Technical Solutions Engineer, Firebase, Google Cloud",,
,"Enterprise Customer Development Representative, Google Cloud (German)",,,"Business Intelligence Analyst, Finance",,,Associate Legal Counsel,,"Consumer Product Marketing Manager, YouTube",,"Mobile Apps Technical Specialist, Online Partnership Group (English and Vietnamese or Hindi)",Technical Recruiter,,"Operations Analyst, Sales, Google Cloud",,"Associate Account Strategist (Russian), Global Customer Experience",,,,"Technical Solutions Engineering Manager, Firebase, Google Cloud",,
,Strategy and Insights Associate/Manager,,,"Revenue Vendor Strategy, Risk and Payments Specialist",,,"Legal Counsel, Development, Production and Licensing, YouTube Originals",,"Visual Designer, Brand Studio",,"Inside Sales and Customer Growth Representative, Google Cloud","Director, People Partner Hardware",,"Program Manager, Google Cloud Regulatory Market",,"Associate Account Strategist, Global Customer Experience (Ukrainian)",,,,"Pre-Sales Solutions Architect, Google Cloud",,
,"Go-To-Market Strategy Manager (EMEA), Pixel",,,Strategic Sourcing Manager,,,"Product/Commercial Counsel (EMEA), Display, Analytics and Syndication",,Digital Marketing Strategist (German),,"Android Platform Partnerships Lead, Android and Play Business (French)","Change Management Specialist, Google Professional Services",,"Technical Program Manager, Angular",,"Account Manager, Automotive (Japanese, English)",,,,"Technical Solutions Consultant, Android TV, Android Partner Engineering",,
,"Strategy and Operations Analyst, Ad Grants",,,"Forensic Auditor, Internal Audit",,,"Field Sales Representative, Federal Government, Google Cloud",,"Field Marketing Manager, Apigee",,"Partner Growth Lead, Global Technology Partnerships (English, German)",Channels Strategy and Operations Manager,,"Merchant Network Planning and Quality Manager, Google Express",,Online Sales Account Manager (Czech or Slovak),,,,"Partner Engineer, Google Assistant, Google Technical Services",,
