Administrative,Business Strategy,Data Center & Network,Developer Relations,Finance,Hardware Engineering,IT & Data Management,Legal & Government Relations,Manufacturing & Supply Chain,Marketing & Communications,Network Engineering,Partnerships,People Operations,Product & Customer Support,Program Management,Real Estate & Workplace Services,Sales & Account Management,Sales Operations,Software Engineering,Technical Infrastructure,Technical Solutions,Technical Writing,User Experience & Design
,"Principal, Strategy, YouTube",,,"Finance Manager, Google Technical Services",,,,,"Head of Internal Communications, Distribution and Go-to-Market, Google Cloud",,,People Partner (HRBP),,"Technical Program Manager, Google Home Platform Software",,"Account Executive (Direct), United Kingdom/Ireland",,,,"Android Partner Engineer, Technical Solutions Consultant",,
,"Go-to-Market Specialist, Google Cloud",,,Financial Analyst,,,,,"Customer Public Relations Manager, Google Cloud",,,Leadership Staffing Researcher (EMEA),,"Program Manager, Third Party Risk Management (3PRM)",,"Agency Lead, Traditional Media Agency, GMS",,,,"Technical Solutions Consultant Manager, Android Automotive Partner Engineering",,
,Risk and Compliance Manager,,,Senior Accountant,,,,,"Product Marketing Manager, Google Cloud Platform Monitoring, Google Cloud",,,Mobility Consultant,,Store Operations Associate,,"Growth Manager, US Gaming, Mobile Apps",,,,"Sales Engineer, Google Cloud Platform",,
,"Business Analyst Intern, Summer 2018",,,"Trading Analyst, Foreign Exchange",,,,,"Product Marketing Manager, Direct SMB Acquisitions",,,"Staffing Channels Specialist, APAC",,Reverse Logistics Program Manager,,"Manager of Store Operations, Hardware Partnerships",,,,"Customer Engineer, Google Cloud Platform (Portuguese and English)",,
,Android Device Strategy Lead,,,Portfolio Strategist,,,,,"Global Head of Music Social and Influencer Marketing, Marketing, YouTube",,,People Operations Business Intelligence Analyst,,"Strategic Relationships Project Manager, Consumer Hardware",,"Business Development Consultant (Spanish), Google Marketing Solutions",,,,"Customer Solutions Engineer, Google Technical Services Ads",,
,"Market Intelligence Analyst, Consumer Hardware Products",,,"Director, Global Payroll Operations",,,,,"Communications Analyst, Physical Security",,,Human Resources Apprenticeship,,Mobile Apps Performance Specialist,,"Account Manager, DoubleClick (Full-time/Part-time)",,,,"Sales Engineering Manager, Google Cloud",,
,"Business Analyst, Strategic Relationships, Japan",,,"APAC Manager, Employment Tax",,,,,"Product Marketing Manager, Apigee Google Cloud Platform",,,Staffing Services Associate Lead,,"Program Manager, Create for Enterprise (Hardware Partnerships)",,"Inside Sales Manager North Asia, Google Cloud (English)",,,,"Operations Lead, Global Support, Measurement and Attribution",,
,"User Engagement Strategy Manager, Google Technical Services, Scaled Engagement and Learning",,,"Financial Analyst, Google Cloud",,,,,"Product Marketing Manager, Growth, Hire Team",,,Channels Project Manager,,"Sales Analyst, Google Cloud",,"Strategic Account Sales Manager Central/LatAm, Google Cloud",,,,"Migration Architect, Google Cloud",,
,"Associate, Business Operations and Strategy",,,"Revenue Accountant, Home Products",,,,,"Business Intern 2017, Australia",,,"Center of Expertise Lead, Organizational Change",,"Chrome Customer Success Manager, Google Cloud",,"App Specialist LCS (CEE), App Developer Sales, EMEA (Multiple Languages)",,,,"Customer Experience Advocate, Google Technical Services (Multiple European Languages)",,
,"Strategy and Operations Excellence Analyst, Google Marketing Solutions",,,"Finance Manager, Photos",,,,,"Brand and Creative Strategist, Brand Studio (APAC)",,,Staffing Project Lead,,"Technical Program Manager, Test Engineering, Verily Life Sciences - South San Francisco",,"Account Manager, Retail Vertical",,,,"Networking Product Specialist, Google Cloud",,
,"Go-to-Market Lead, Southeast Asia/India Partnerships",,,Payments Compliance Regulatory Licensing and Reporting Manager,,,,,Head of BrandLab,,,"Analyst, Staffing and Operations",,"Partner Program Design Manager, Technology Partners, Google Cloud",,"APAC SMB Account Manager, Google Cloud (Mandarin, Cantonese)",,,,"Internet of Things (IoT) Product Specialist, Google Cloud",,
,"Business Systems Analyst, Financial Applications",,,"Accountant, Payments",,,,,"Developer Product Marketing Manager, Google Play",,,"Program Manager, Supplier Management Office, Extended Workforce Solutions",,"Program Manager, Security Ecosystem, Google Cloud",,"Business Development Manager, Agency",,,,"Technical Solutions Consultant, Verily Life Sciences - Mountain View",,
,,,,"Internal Audit, Technology Audit Manager",,,,,"Customer Reference Marketing Manager, Google Cloud",,,"Executive Search Consultant, EMEA",,"Program Manager, Alphabet Treasury, Corporate Engineering",,Account Manager,,,,"Vendor Manager, Google Technical Services",,
,,,,"Compliance Manager (SOX), Internal Controls",,,,,"Director of Go-To-Market Communications, Google Cloud",,,"Content Manager, Google Careers",,"Head of Professional Services (English, French)",,Analytical Consultant,,,,"Product Lifecycle Management, Business Systems",,
,,,,"Residual Manager, YouTube Originals",,,,,"Developer Product Marketing Manager, Google Play",,,Candidate Offer Assessment Specialist (Tech),,"Business Lead, Partner Directory, Google Cloud",,"App Specialist, App Developer Sales (German)",,,,"Pre-Sales Solutions Architect Manager, Google Cloud",,
,,,,"Payroll Business Systems Analyst, HR Interfaces",,,,,"Partner Marketing Manager, Google Cloud Marketing (Japan)",,,"Policy Lead, Extended Workforce Solutions",,"Customer Experience Data Scientist, Google Cloud Support",,"Associate Account Strategist, Global Customer Services (French)",,,,"Networking Product Specialist, Google Cloud (English)",,
,,,,"Senior Manager, Supply Chain",,,,,"Marketing Analytics Manager, SMB Marketing",,,People Consultant Pod Manager,,"Business Lead, Partner to Partner Exchange, Google Cloud",,"Analytical Consultant, Finance (Hebrew)",,,,"Manager, Technical Specialists, Google Technical Services",,
,,,,"Accountant, Home Products",,,,,"Ads Marketing Manager, Latin America, Waze (Spanish)",,,"Manager, Sales Compensation Design and Compensation Partner",,JAPAC Partner Onboarding Manager,,"Managing Editor, Google Technical Services, Ads, Scaled Engagement and Learning",,,,"Measurement Solutions Consultant (English, Japanese)",,
,,,,Entity Controller,,,,,"Product Marketing Manager, YouTube Music and Subscriptions",,,Compensation Analyst,,,,"SMB Sales Manager, North America, Google Cloud",,,,"Brand Specialist, Google Professional Services",,
,,,,"Internal Audit, Infrastructure Technology Audit Manager",,,,,"Product Marketing Manager (PMM), SMB Marketing",,,,,,,"Strategic Agency Consultant (MENA), Google Marketing Solutions",,,,"Technical Specialist, Shopping, Google Professional Services (French)",,
,,,,"Internal Controls (SOX) Manager, Cloud Business Finance",,,,,"Business Development Consultant, Google Marketing Solutions (Swedish)",,,,,,,"Enterprise Customer Development Representative, Google Cloud (Nordics)",,,,"Associate Account Strategist (Polish), Global Customer Experience",,
,,,,"Portfolio Manager, Investment Grade Corporates",,,,,"Digital Analyst, Google Cloud Online Experience",,,,,,,"Strategic Agency Consultant (Switzerland, Austria), Google Marketing Solutions",,,,"Technical Account Manager, Google Technical Services Global Customer Care (English, Japanese)",,
,,,,Senior Credit Research Analyst,,,,,"Product Marketing Manager, CRM, Google Store",,,,,,,"Account Strategist (English, Portuguese)",,,,"Specialist, Google Analytics Solutions",,
,,,,"North America Payroll, Project and Process Manager",,,,,"Global Lead, Industry Solutions, Health and Life Sciences Marketing, Google Cloud",,,,,,,Sales Development Manager (SDM),,,,,,
,,,,"Program Manager, Alphabet PMO",,,,,"Head of Creative, Retail Marketing",,,,,,,"Field Sales Manager, Google Cloud",,,,,,
,,,,"Supply Chain Finance Senior Analyst, Consumer Hardware",,,,,"Product Marketing Manager, Digital Skills for Economic Impact",,,,,,,"Mobile Sites UX and Conversion Specialist (German), Performance Team",,,,,,
,,,,Treasury Accountant,,,,,"Partner Marketing Manager, Retail",,,,,,,"Sales Executive, Google Cloud Platform",,,,,,
,,,,"Finance Director, Google Fixed Assets (GFA)",,,,,"Retail Strategy Lead, Retail Marketing",,,,,,,"Account Manager, Channel Sales",,,,,,
,,,,Revenue Systems Senior Accountant,,,,,"Associate Account Strategist, Sales, Google Marketing Solutions (English and Russian)",,,,,,,Online Sales Account Strategist (Italian),,,,,,
,,,,Senior Financial Analyst,,,,,"Store Campaigns Manager, Merchandising, Google Play",,,,,,,"Sales Associate, Large Customer Sales",,,,,,
,,,,"Senior Accountant, Revenue, Cloud Business Finance",,,,,Internal Communications Manager,,,,,,,"Associate Account Strategist (Polish), Google Marketing Solutions Sales",,,,,,
,,,,SAP Alphabet Senior Accountant,,,,,"Program Manager, Communications, Google Cloud",,,,,,,"Business Development Consultant, Google Marketing Solutions (Italian)",,,,,,
,,,,"Senior Accountant, Play Business Controller",,,,,"Creative Lead, Marketing (India)",,,,,,,"Analytical Lead, Home and Personal Care Vertical",,,,,,
,,,,Senior Treasury Analytics Manager,,,,,"Head of Field Marketing, Google Cloud (English, German)",,,,,,,"Inside Sales Executive, Google Cloud",,,,,,
,,,,"U.S. Tax Analyst, Employment Tax",,,,,"Copywriter, Web, Google Cloud",,,,,,,"Mobile UX Specialist, Large Customer Sales (English, Japanese)",,,,,,
,,,,,,,,,"Events Manager Lead, Google Cloud Marketing",,,,,,,"Manager, Mid Market Sales",,,,,,
,,,,,,,,,Media Research Manager,,,,,,,"Platforms Industry Manager, DoubleClick and Google Analytics 360",,,,,,
,,,,,,,,,"Branding and Video Specialist, Northern Europe",,,,,,,"Account Executive, Waze",,,,,,
,,,,,,,,,"Communications Manager, Search",,,,,,,"Analytical Lead, Media and Entertainment Vertical",,,,,,
,,,,,,,,,Product Marketing Manager,,,,,,,"Sales and Customer Growth Strategist, Google Cloud (Spanish)",,,,,,
,,,,,,,,,"Marketing Analyst, Product Growth",,,,,,,"Account Executive, Programmatic (Spanish)",,,,,,
,,,,,,,,,"Interactive Design Manager, Retail Marketing",,,,,,,"Account Executive, Waze (Spanish)",,,,,,
,,,,,,,,,"Visual Designer, Events and Experiences",,,,,,,"Google Analytics Solutions, Specialist (Korean)",,,,,,
,,,,,,,,,"Internal and Executive Communications Associate, Daydream",,,,,,,Search Specialist (Swedish),,,,,,
,,,,,,,,,"Marketing Analytics Manager, Retail Marketing",,,,,,,"Account Executive, Google Cloud",,,,,,
,,,,,,,,,AR and VR Writer,,,,,,,"Head of South East Asia Inside Sales, Google Cloud (English)",,,,,,
,,,,,,,,,"Creative Technology Lead, Brand Studio (APAC)",,,,,,,"Deal Lead, Japan (English, Japanese)",,,,,,
,,,,,,,,,"Product Marketing Manager, SMB Marketing (Spanish)",,,,,,,Brand Specialist (Fixed-Term Employee),,,,,,
,,,,,,,,,Public Policy and Government Relations Manager for Southern Cone (English and Spanish speaker),,,,,,,"Account Manager, Large Customer Sales",,,,,,
,,,,,,,,,"Product Marketing Manager, Networking, Google Cloud",,,,,,,Online Sales Account Manager (Spanish),,,,,,
,,,,,,,,,"Global Go-to-Market Strategy Lead, Retail Marketing",,,,,,,"Industry Manager, Telecom (English and Russian speaking)",,,,,,
,,,,,,,,,"Product Marketing Manager, Google Analytics",,,,,,,"Account Strategist, Google Marketing Solutions Sales (Portuguese)",,,,,,
,,,,,,,,,"Product Marketing Manager, Startups, SMB Marketing (English, German)",,,,,,,"Account Manager, Media, Large Customer Sales (UKI)",,,,,,
,,,,,,,,,"Product Marketing Manager, Consumer Strategy",,,,,,,"Inside Sales and Customer Growth Representative, Google Cloud (English, Mandarin, Cantonese)",,,,,,
,,,,,,,,,"Demand Generation Marketing Manager, North America Growth Marketing, Google Cloud",,,,,,,"Programmatic Industry Manager (English, Bahasa Indonesia)",,,,,,
,,,,,,,,,"Head of Communications, EMEA Marketing",,,,,,,"Market Lead, Google Marketing Solutions (Lithuanian, Latvian or Estonian)",,,,,,
,,,,,,,,,"Product Marketing Manager, Windows, Google Cloud Platform",,,,,,,"Sales Manager, Gaming, Mobile Apps",,,,,,
,,,,,,,,,Consumer Insights Manager,,,,,,,"Online Sales Account Manager, Large Customer Sales (Norwegian, Danish, Swedish)",,,,,,
,,,,,,,,,"Data Strategist, Online Partnerships Group",,,,,,,"Inside Sales Manager Japan, Google Cloud",,,,,,
,,,,,,,,,"Policy Advisor, Trust and Safety",,,,,,,"Industry Manager, Branding (English, Russian)",,,,,,
,,,,,,,,,"Content Policy Manager, Asia Pacific (Full-time/Part-time)",,,,,,,"Enterprise Customer Development Representative, Google Cloud (French)",,,,,,
,,,,,,,,,Associate Product Marketing Manager,,,,,,,"Account Manager, Mobile App Sales (Vietnamese, English)",,,,,,
,,,,,,,,,"Channel Partner Marketing Manager, Devices, Google Cloud",,,,,,,"Head of India Inside Sales, Google Cloud",,,,,,
,,,,,,,,,"Product Marketing Manager, Google Hardware",,,,,,,"Business Development Manager, Rich Communications Services (RCS)",,,,,,
,,,,,,,,,"Alliances Marketing Manager, Google Cloud",,,,,,,"Political Advertising Program, Summer-Fall 2018",,,,,,
,,,,,,,,,,,,,,,,"Strategic Partner Manager (Nordics), Online Partnerships Group",,,,,,
,,,,,,,,,,,,,,,,"Account Manager, DoubleClick (Mandarin)",,,,,,
,,,,,,,,,,,,,,,,Platforms Account Manager,,,,,,
,,,,,,,,,,,,,,,,"Sales Manager (DACH), Google Cloud",,,,,,
,,,,,,,,,,,,,,,,"Inside Sales Manager, Google Cloud",,,,,,
,,,,,,,,,,,,,,,,"Head of Inside Sales, Google Cloud (English)",,,,,,
,,,,,,,,,,,,,,,,"Sales Engineer, Google Cloud",,,,,,
,,,,,,,,,,,,,,,,"Head of Channel Sales, Russia and CIS",,,,,,
,,,,,,,,,,,,,,,,"Enterprise Customer Development Representative, Google Cloud (Italian)",,,,,,
,,,,,,,,,,,,,,,,Head of Creative Agencies,,,,,,
,,,,,,,,,,,,,,,,"Account Manager, Branding",,,,,,
,,,,,,,,,,,,,,,,"Strategic Partner Manager, Carrier",,,,,,
,,,,,,,,,,,,,,,,Account Strategist (Hebrew),,,,,,
,,,,,,,,,,,,,,,,"Shopping Specialist, Large Customer Sales (English, Mandarin)",,,,,,
,,,,,,,,,,,,,,,,"Account Manager, Display, Media Buying Solutions (Italian)",,,,,,
,,,,,,,,,,,,,,,,"Account Manager, App Developer Sales",,,,,,
,,,,,,,,,,,,,,,,"Cloud Manager (German), Inside Sales",,,,,,
,,,,,,,,,,,,,,,,"Associate Account Strategist (Czech/Slovak), Sales, Google Marketing Solutions",,,,,,
,,,,,,,,,,,,,,,,"Associate Account Strategist (Hungarian), GMS Sales",,,,,,
,,,,,,,,,,,,,,,,"Analytical Consultant, Auto (English, Russian)",,,,,,
,,,,,,,,,,,,,,,,Online Sales Account Manager (Portuguese),,,,,,
,,,,,,,,,,,,,,,,"Enterprise Customer Development Representative, Google Cloud (Spanish)",,,,,,
